{
  "bundle_id": "example/golden-path-bundle",
  "bundle_version": "0.2.2",
  "content_digest": "2222222222222222222222222222222222222222222222222222222222222222",
  "decks": [
    {
      "deck_id": "example/deck/deck-a",
      "digest": "0000000000000000000000000000000000000000000000000000000000000000",
      "player": 1
    },
    {
      "deck_id": "example/deck/deck-b",
      "digest": "1111111111111111111111111111111111111111111111111111111111111111",
      "player": 2
    }
  ],
  "definition_ids": [
    "example/card/example-card"
  ],
  "exclusions": [
    "Illustrative only; no executable rules or cards."
  ],
  "generated_definition_ids": [],
  "native_executors": [],
  "required_capabilities": [
    "mechanic/example-draw"
  ],
  "schema_version": "bundle-manifest.v1",
  "snapshots": {
    "format_policy": "TBD-format",
    "legality": "TBD-legality",
    "oracle": "example-source",
    "rules": "TBD-rules",
    "rulings": "TBD-rulings"
  },
  "status": "example"
}
